{
  "version": 1,
  "type": "transaction.completed",
  "domain": "marketplace.example.com",
  "subject": "a55bea0a6788794ef1307951f98bc339db7ccf9309881180e9e6c080f63ae618",
  "timestamp": "2026-02-14T15:30:00Z",
  "metadata": {
    "amount": 149.99,
    "currency": "USD",
    "category": "electronics"
  }
}
